{
  "$schema": "../loot-table.schema.json",
  "id": "forgotten-miner-scrap",
  "notes": "Tier 1 scrap (economy doc: 40% drop a scrap item worth 5-15): 40% a bent pick head (8) or a rusted lamp hook (12), otherwise nothing.",
  "rolls": {
    "min": 1,
    "max": 1
  },
  "entries": [
    {
      "item": "gold",
      "weight": 60,
      "count": {
        "min": 0,
        "max": 0
      }
    },
    {
      "item": "bent-pick-head",
      "weight": 24
    },
    {
      "item": "rusted-lamp-hook",
      "weight": 16
    }
  ]
}
