{
  "$schema": "../loot-table.schema.json",
  "id": "valley-chest-superior-gear",
  "notes": "One gear piece for the valley's hidden superior chest (mw-ju8.20), rolled by valley-chest-superior's gear entry: the better existing pieces (base value 90-200). Not tuned.",
  "rolls": { "min": 1, "max": 1 },
  "entries": [
    { "item": "tempered-hunting-knife", "weight": 2 },
    { "item": "padded-gambeson", "weight": 2 },
    { "item": "short-sword", "weight": 2 },
    { "item": "kettle-helm", "weight": 1 },
    { "item": "mail-gauntlets", "weight": 1 }
  ]
}
